{
	"$schema": "https://json-schema.org/draft/2020-12/schema",
	"$id": "https://ue-shed.dev/contracts/cameras/review/v1/capture-request.schema.json",
	"title": "UE Shed Map Review capture request v1",
	"type": "object",
	"additionalProperties": false,
	"required": ["contract", "operationId", "viewId", "expectedMapPath", "subject", "resolution"],
	"properties": {
		"contract": {
			"type": "object",
			"additionalProperties": false,
			"required": ["name", "version"],
			"properties": {
				"name": {
					"const": "ue-shed-review-capture"
				},
				"version": {
					"type": "object",
					"additionalProperties": false,
					"required": ["major", "minor"],
					"properties": {
						"major": {
							"const": 1
						},
						"minor": {
							"type": "integer",
							"minimum": 0,
							"maximum": 7
						}
					}
				}
			}
		},
		"operationId": {
			"type": "string",
			"format": "uuid",
			"pattern": "^[0-9a-fA-F]{8}-[0-9a-fA-F]{4}-[0-9a-fA-F]{4}-[0-9a-fA-F]{4}-[0-9a-fA-F]{12}$",
			"not": {
				"const": "00000000-0000-0000-0000-000000000000"
			}
		},
		"viewId": {
			"$ref": "#/$defs/safeId"
		},
		"expectedMapPath": {
			"type": "string",
			"minLength": 1
		},
		"subject": {
			"oneOf": [
				{
					"type": "object",
					"additionalProperties": false,
					"required": ["kind", "actorGuid"],
					"properties": {
						"kind": {
							"const": "actor_guid"
						},
						"actorGuid": {
							"type": "string",
							"pattern": "^[0-9a-fA-F]{8}(?:-[0-9a-fA-F]{8}){3}$",
							"not": {
								"const": "00000000-00000000-00000000-00000000"
							}
						},
						"lastKnownActorPath": {
							"type": "string",
							"minLength": 7,
							"maxLength": 4096,
							"pattern": "^/Game/"
						},
						"diagnosticLabel": {
							"type": "string",
							"minLength": 1
						}
					}
				},
				{
					"type": "object",
					"additionalProperties": false,
					"required": ["kind", "actorPath"],
					"properties": {
						"kind": {
							"const": "actor_path"
						},
						"actorPath": {
							"type": "string",
							"minLength": 7,
							"maxLength": 4096,
							"pattern": "^/Game/"
						},
						"diagnosticLabel": {
							"type": "string",
							"minLength": 1
						}
					}
				},
				{
					"type": "object",
					"additionalProperties": false,
					"required": ["kind", "bounds"],
					"properties": {
						"kind": {
							"const": "oriented_bounds"
						},
						"bounds": {
							"$ref": "#/$defs/bounds"
						}
					}
				}
			]
		},
		"approvedPose": {
			"type": "object",
			"additionalProperties": false,
			"required": ["aspectRatio", "fieldOfViewDegrees", "location", "projection", "rotation"],
			"properties": {
				"aspectRatio": {
					"const": "16:9"
				},
				"fieldOfViewDegrees": {
					"type": "number",
					"minimum": 5,
					"maximum": 170
				},
				"projection": {
					"const": "perspective"
				},
				"location": {
					"$ref": "#/$defs/vector"
				},
				"rotation": {
					"$ref": "#/$defs/rotation"
				}
			}
		},
		"resolution": {
			"type": "object",
			"additionalProperties": false,
			"required": ["width", "height"],
			"properties": {
				"width": {
					"type": "integer",
					"minimum": 160,
					"maximum": 3840
				},
				"height": {
					"type": "integer",
					"minimum": 90,
					"maximum": 2160
				}
			}
		},
		"assessment": {
			"$ref": "#/$defs/assessment"
		},
		"clearCompanion": {
			"$ref": "#/$defs/clearCompanion"
		},
		"viewpoint": {
			"$ref": "#/$defs/viewpoint"
		},
		"renderPolicy": {
			"allOf": [
				{
					"$ref": "../../render/v1/policy.schema.json"
				},
				{
					"not": {
						"required": ["visibility"]
					}
				}
			]
		},
		"authoredVisibility": {
			"type": "object",
			"properties": {
				"version": {
					"type": "number",
					"enum": [1]
				},
				"output": {
					"type": "string",
					"enum": ["natural_only", "authored_only", "natural_and_authored"]
				},
				"actors": {
					"type": "object",
					"properties": {
						"hide": {
							"type": "array",
							"items": {
								"type": "object",
								"properties": {
									"locator": {
										"anyOf": [
											{
												"type": "object",
												"properties": {
													"kind": {
														"type": "string",
														"enum": ["actor_path"]
													},
													"actorPath": {
														"type": "string",
														"allOf": [
															{
																"pattern": "^\\/Game\\/"
															},
															{
																"maxLength": 4096
															}
														]
													}
												},
												"required": ["kind", "actorPath"],
												"additionalProperties": false
											},
											{
												"type": "object",
												"properties": {
													"kind": {
														"type": "string",
														"enum": ["actor_guid"]
													},
													"actorGuid": {
														"type": "string",
														"allOf": [
															{
																"pattern": "^(?!00000000-00000000-00000000-00000000$)[0-9a-fA-F]{8}(?:-[0-9a-fA-F]{8}){3}$"
															}
														]
													},
													"lastKnownActorPath": {
														"type": "string",
														"allOf": [
															{
																"maxLength": 4096
															}
														]
													}
												},
												"required": [
													"kind",
													"actorGuid",
													"lastKnownActorPath"
												],
												"additionalProperties": false
											}
										]
									},
									"label": {
										"type": "string",
										"allOf": [
											{
												"maxLength": 256
											}
										]
									}
								},
								"required": ["locator", "label"],
								"additionalProperties": false
							},
							"allOf": [
								{
									"maxItems": 256
								}
							]
						},
						"protect": {
							"type": "array",
							"items": {
								"type": "object",
								"properties": {
									"locator": {
										"anyOf": [
											{
												"type": "object",
												"properties": {
													"kind": {
														"type": "string",
														"enum": ["actor_path"]
													},
													"actorPath": {
														"type": "string",
														"allOf": [
															{
																"pattern": "^\\/Game\\/"
															},
															{
																"maxLength": 4096
															}
														]
													}
												},
												"required": ["kind", "actorPath"],
												"additionalProperties": false
											},
											{
												"type": "object",
												"properties": {
													"kind": {
														"type": "string",
														"enum": ["actor_guid"]
													},
													"actorGuid": {
														"type": "string",
														"allOf": [
															{
																"pattern": "^(?!00000000-00000000-00000000-00000000$)[0-9a-fA-F]{8}(?:-[0-9a-fA-F]{8}){3}$"
															}
														]
													},
													"lastKnownActorPath": {
														"type": "string",
														"allOf": [
															{
																"maxLength": 4096
															}
														]
													}
												},
												"required": [
													"kind",
													"actorGuid",
													"lastKnownActorPath"
												],
												"additionalProperties": false
											}
										]
									},
									"label": {
										"type": "string",
										"allOf": [
											{
												"maxLength": 256
											}
										]
									}
								},
								"required": ["locator", "label"],
								"additionalProperties": false
							},
							"allOf": [
								{
									"maxItems": 256
								}
							]
						}
					},
					"required": ["hide", "protect"],
					"additionalProperties": false
				}
			},
			"required": ["version", "output", "actors"],
			"additionalProperties": false
		}
	},
	"allOf": [
		{
			"if": {
				"properties": {
					"contract": {
						"properties": {
							"version": {
								"properties": {
									"minor": {
										"enum": [2, 3, 4, 5, 6]
									}
								}
							}
						}
					}
				}
			},
			"then": {
				"required": ["assessment", "viewpoint"]
			},
			"else": {
				"required": ["approvedPose"]
			}
		},
		{
			"if": {
				"properties": {
					"contract": {
						"properties": {
							"version": {
								"properties": {
									"minor": {
										"enum": [4, 5, 6]
									}
								}
							}
						}
					}
				}
			},
			"then": {
				"required": ["clearCompanion"]
			},
			"else": {
				"not": {
					"required": ["clearCompanion"]
				}
			}
		},
		{
			"if": {
				"properties": {
					"subject": {
						"required": ["kind"],
						"properties": {
							"kind": {
								"const": "actor_guid"
							}
						}
					}
				}
			},
			"then": {
				"properties": {
					"contract": {
						"properties": {
							"version": {
								"properties": {
									"minor": {
										"enum": [5, 6]
									}
								}
							}
						}
					}
				}
			}
		},
		{
			"if": {
				"properties": {
					"contract": {
						"properties": {
							"version": {
								"properties": {
									"minor": {
										"enum": [6, 7]
									}
								}
							}
						}
					}
				}
			},
			"then": {
				"required": ["renderPolicy"]
			},
			"else": {
				"not": {
					"required": ["renderPolicy"]
				}
			}
		},
		{
			"if": {
				"required": ["authoredVisibility"]
			},
			"then": {
				"properties": {
					"contract": {
						"properties": {
							"version": {
								"properties": {
									"minor": {
										"const": 7
									}
								}
							}
						}
					},
					"clearCompanion": {
						"properties": {
							"status": {
								"const": "not_requested"
							}
						}
					}
				}
			}
		}
	],
	"$defs": {
		"safeId": {
			"type": "string",
			"pattern": "^[A-Za-z0-9][A-Za-z0-9._-]{0,127}$"
		},
		"vector": {
			"type": "object",
			"additionalProperties": false,
			"required": ["x", "y", "z"],
			"properties": {
				"x": {
					"type": "number"
				},
				"y": {
					"type": "number"
				},
				"z": {
					"type": "number"
				}
			}
		},
		"rotation": {
			"type": "object",
			"additionalProperties": false,
			"required": ["pitch", "yaw", "roll"],
			"properties": {
				"pitch": {
					"type": "number"
				},
				"yaw": {
					"type": "number"
				},
				"roll": {
					"type": "number"
				}
			}
		},
		"bounds": {
			"type": "object",
			"additionalProperties": false,
			"required": ["center", "extent", "rotation"],
			"properties": {
				"center": {
					"$ref": "#/$defs/vector"
				},
				"extent": {
					"$ref": "#/$defs/vector"
				},
				"rotation": {
					"$ref": "#/$defs/rotation"
				}
			}
		},
		"assessment": {
			"oneOf": [
				{
					"type": "object",
					"additionalProperties": false,
					"required": ["method"],
					"properties": {
						"method": {
							"const": "automatic"
						}
					}
				},
				{
					"type": "object",
					"additionalProperties": false,
					"required": ["method", "samplePreset"],
					"properties": {
						"method": {
							"const": "ray_samples"
						},
						"samplePreset": {
							"enum": ["sparse", "standard", "dense"]
						}
					}
				},
				{
					"type": "object",
					"additionalProperties": false,
					"required": ["method"],
					"properties": {
						"method": {
							"enum": ["subject_mask", "depth_compare"]
						}
					}
				}
			]
		},
		"clearCompanion": {
			"oneOf": [
				{
					"type": "object",
					"additionalProperties": false,
					"required": ["status"],
					"properties": {
						"status": {
							"const": "not_requested"
						}
					}
				},
				{
					"type": "object",
					"additionalProperties": false,
					"required": ["status", "strategy"],
					"properties": {
						"status": {
							"const": "requested"
						},
						"strategy": {
							"const": "isolate_target"
						}
					}
				},
				{
					"type": "object",
					"additionalProperties": false,
					"required": ["actors", "status", "strategy"],
					"properties": {
						"actors": {
							"type": "array",
							"minItems": 1,
							"maxItems": 32,
							"uniqueItems": true,
							"items": {
								"type": "string",
								"minLength": 7,
								"maxLength": 4096,
								"pattern": "^/Game/"
							}
						},
						"status": {
							"const": "requested"
						},
						"strategy": {
							"const": "hide_explicit"
						}
					}
				}
			]
		},
		"viewpoint": {
			"oneOf": [
				{
					"type": "object",
					"additionalProperties": false,
					"required": ["kind", "approvedPose"],
					"properties": {
						"kind": {
							"const": "world_fixed"
						},
						"approvedPose": {
							"$ref": "#/$defs/pose"
						}
					}
				},
				{
					"type": "object",
					"additionalProperties": false,
					"required": ["kind", "relativePose", "targetSnapshot"],
					"properties": {
						"kind": {
							"const": "target_relative"
						},
						"relativePose": {
							"$ref": "#/$defs/pose"
						},
						"targetSnapshot": {
							"type": "object",
							"additionalProperties": false,
							"required": ["location", "rotation"],
							"properties": {
								"location": {
									"$ref": "#/$defs/vector"
								},
								"rotation": {
									"$ref": "#/$defs/rotation"
								}
							}
						}
					}
				}
			]
		},
		"pose": {
			"type": "object",
			"additionalProperties": false,
			"required": ["aspectRatio", "fieldOfViewDegrees", "location", "projection", "rotation"],
			"properties": {
				"aspectRatio": {
					"const": "16:9"
				},
				"fieldOfViewDegrees": {
					"type": "number",
					"minimum": 5,
					"maximum": 170
				},
				"projection": {
					"const": "perspective"
				},
				"location": {
					"$ref": "#/$defs/vector"
				},
				"rotation": {
					"$ref": "#/$defs/rotation"
				}
			}
		}
	}
}
