{
	"contract": {
		"name": "ue-shed-review-capture",
		"version": { "major": 1, "minor": 1 }
	},
	"operationId": "11111111-1111-4111-8111-111111111111",
	"viewId": "structure-context",
	"expectedMapPath": "/Game/Fixture/Cameras/L_CameraLoad",
	"subject": {
		"kind": "actor_path",
		"actorPath": "/Game/Fixture/Cameras/L_CameraLoad.L_CameraLoad:PersistentLevel.ReviewSubject"
	},
	"approvedPose": {
		"aspectRatio": "16:9",
		"fieldOfViewDegrees": 70,
		"projection": "perspective",
		"location": { "x": 100, "y": 200, "z": 300 },
		"rotation": { "pitch": -20, "yaw": 45, "roll": 0 }
	},
	"resolution": { "width": 1280, "height": 720 }
}
