{
	"assessment": { "method": "automatic" },
	"clearCompanion": {
		"status": "requested",
		"strategy": "hide_explicit",
		"actors": ["/Game/Fixture/Cameras/L_CameraLoad.L_CameraLoad:PersistentLevel.ReviewOccluder"]
	},
	"contract": {
		"name": "ue-shed-review-capture",
		"version": { "major": 1, "minor": 4 }
	},
	"operationId": "33333333-3333-4333-8333-333333333333",
	"viewId": "structure-clear",
	"expectedMapPath": "/Game/Fixture/Cameras/L_CameraLoad",
	"subject": {
		"kind": "actor_path",
		"actorPath": "/Game/Fixture/Cameras/L_CameraLoad.L_CameraLoad:PersistentLevel.ReviewSubject"
	},
	"viewpoint": {
		"kind": "world_fixed",
		"approvedPose": {
			"aspectRatio": "16:9",
			"fieldOfViewDegrees": 70,
			"projection": "perspective",
			"location": { "x": 1200, "y": -900, "z": 700 },
			"rotation": { "pitch": -20, "yaw": 145, "roll": 0 }
		}
	},
	"resolution": { "width": 1280, "height": 720 }
}
